{
  "version_esquema": "ModelQualityRollup_v1",
  "generated_at_utc": "2026-02-20T06:21:44+00:00",
  "source_log_path": "_evaluacion/votes_log_v1.jsonl",
  "coverage": {
    "events_total": 168,
    "events_valid": 168,
    "parse_errors": 0,
    "cases": 14,
    "canonical_steps": 9
  },
  "min_samples_per_step_model": 20,
  "per_model_step_stats": [
    {
      "canonical_step_name": "ARBITRO",
      "backend": "claude",
      "n_votes": 5,
      "mean": 79.46,
      "p25": 66.0,
      "median": 66.0,
      "p75": 100.0,
      "last_seen_utc": "2026-02-19T13:47:59+00:00",
      "sample_sufficiency": false,
      "rules_failed_top": [
        {
          "rule": "critical_fields_completeness",
          "count": 3
        }
      ]
    },
    {
      "canonical_step_name": "ARBITRO",
      "backend": "codex",
      "n_votes": 5,
      "mean": 93.32,
      "p25": 100.0,
      "median": 100.0,
      "p75": 100.0,
      "last_seen_utc": "2026-02-19T13:47:59+00:00",
      "sample_sufficiency": false,
      "rules_failed_top": [
        {
          "rule": "critical_fields_completeness",
          "count": 1
        }
      ]
    },
    {
      "canonical_step_name": "ARBITRO",
      "backend": "gemini",
      "n_votes": 5,
      "mean": 86.58,
      "p25": 67.0,
      "median": 100.0,
      "p75": 100.0,
      "last_seen_utc": "2026-02-19T13:47:59+00:00",
      "sample_sufficiency": false,
      "rules_failed_top": [
        {
          "rule": "critical_fields_completeness",
          "count": 2
        }
      ]
    },
    {
      "canonical_step_name": "BULL",
      "backend": "claude",
      "n_votes": 5,
      "mean": 91.8,
      "p25": 98.0,
      "median": 98.0,
      "p75": 99.0,
      "last_seen_utc": "2026-02-19T11:58:38+00:00",
      "sample_sufficiency": false,
      "rules_failed_top": [
        {
          "rule": "critical_fields_completeness",
          "count": 1
        }
      ]
    },
    {
      "canonical_step_name": "BULL",
      "backend": "codex",
      "n_votes": 5,
      "mean": 98.02,
      "p25": 98.0,
      "median": 98.0,
      "p75": 99.0,
      "last_seen_utc": "2026-02-19T11:58:38+00:00",
      "sample_sufficiency": false,
      "rules_failed_top": []
    },
    {
      "canonical_step_name": "BULL",
      "backend": "gemini",
      "n_votes": 5,
      "mean": 92.21,
      "p25": 98.0,
      "median": 98.0,
      "p75": 99.0,
      "last_seen_utc": "2026-02-19T11:58:38+00:00",
      "sample_sufficiency": false,
      "rules_failed_top": [
        {
          "rule": "critical_fields_completeness",
          "count": 1
        }
      ]
    },
    {
      "canonical_step_name": "CATALYST_DETECTION",
      "backend": "claude",
      "n_votes": 1,
      "mean": 65.34,
      "p25": 65.0,
      "median": 65.0,
      "p75": 65.0,
      "last_seen_utc": "2026-02-20T06:21:44+00:00",
      "sample_sufficiency": false,
      "rules_failed_top": [
        {
          "rule": "schema_valid",
          "count": 1
        }
      ]
    },
    {
      "canonical_step_name": "CATALYST_DETECTION",
      "backend": "codex",
      "n_votes": 1,
      "mean": 100.0,
      "p25": 100.0,
      "median": 100.0,
      "p75": 100.0,
      "last_seen_utc": "2026-02-20T06:21:44+00:00",
      "sample_sufficiency": false,
      "rules_failed_top": []
    },
    {
      "canonical_step_name": "FORENSIC_DETECTION",
      "backend": "claude",
      "n_votes": 2,
      "mean": 65.13,
      "p25": 65.0,
      "median": 65.0,
      "p75": 66.0,
      "last_seen_utc": "2026-02-20T06:20:07+00:00",
      "sample_sufficiency": false,
      "rules_failed_top": [
        {
          "rule": "schema_valid",
          "count": 2
        }
      ]
    },
    {
      "canonical_step_name": "FORENSIC_DETECTION",
      "backend": "codex",
      "n_votes": 2,
      "mean": 83.01,
      "p25": 66.0,
      "median": 66.0,
      "p75": 100.0,
      "last_seen_utc": "2026-02-20T06:20:07+00:00",
      "sample_sufficiency": false,
      "rules_failed_top": [
        {
          "rule": "schema_valid",
          "count": 1
        }
      ]
    },
    {
      "canonical_step_name": "FORENSIC_DETECTION",
      "backend": "gemini",
      "n_votes": 1,
      "mean": 100.0,
      "p25": 100.0,
      "median": 100.0,
      "p75": 100.0,
      "last_seen_utc": "2026-02-20T06:20:07+00:00",
      "sample_sufficiency": false,
      "rules_failed_top": []
    },
    {
      "canonical_step_name": "RED_TEAM",
      "backend": "claude",
      "n_votes": 4,
      "mean": 90.45,
      "p25": 66.0,
      "median": 98.0,
      "p75": 98.0,
      "last_seen_utc": "2026-02-19T12:11:03+00:00",
      "sample_sufficiency": false,
      "rules_failed_top": [
        {
          "rule": "critical_fields_completeness",
          "count": 1
        }
      ]
    },
    {
      "canonical_step_name": "RED_TEAM",
      "backend": "codex",
      "n_votes": 4,
      "mean": 98.94,
      "p25": 98.0,
      "median": 99.0,
      "p75": 99.0,
      "last_seen_utc": "2026-02-19T12:11:03+00:00",
      "sample_sufficiency": false,
      "rules_failed_top": []
    },
    {
      "canonical_step_name": "RED_TEAM",
      "backend": "gemini",
      "n_votes": 4,
      "mean": 91.2,
      "p25": 67.0,
      "median": 99.0,
      "p75": 99.0,
      "last_seen_utc": "2026-02-19T12:11:03+00:00",
      "sample_sufficiency": false,
      "rules_failed_top": [
        {
          "rule": "critical_fields_completeness",
          "count": 1
        }
      ]
    }
  ],
  "fusion_comparison": [
    {
      "canonical_step_name": "ARBITRO",
      "backend": "claude",
      "n_pairs": 5,
      "delta_vs_fusion_mean": -13.84,
      "wins_vs_fusion_count": 0,
      "losses_vs_fusion_count": 4,
      "ties_vs_fusion_count": 1
    },
    {
      "canonical_step_name": "ARBITRO",
      "backend": "codex",
      "n_pairs": 5,
      "delta_vs_fusion_mean": 0.02,
      "wins_vs_fusion_count": 3,
      "losses_vs_fusion_count": 0,
      "ties_vs_fusion_count": 2
    },
    {
      "canonical_step_name": "ARBITRO",
      "backend": "gemini",
      "n_pairs": 5,
      "delta_vs_fusion_mean": -6.72,
      "wins_vs_fusion_count": 0,
      "losses_vs_fusion_count": 5,
      "ties_vs_fusion_count": 0
    },
    {
      "canonical_step_name": "BULL",
      "backend": "claude",
      "n_pairs": 5,
      "delta_vs_fusion_mean": -6.54,
      "wins_vs_fusion_count": 2,
      "losses_vs_fusion_count": 3,
      "ties_vs_fusion_count": 0
    },
    {
      "canonical_step_name": "BULL",
      "backend": "codex",
      "n_pairs": 5,
      "delta_vs_fusion_mean": -0.32,
      "wins_vs_fusion_count": 2,
      "losses_vs_fusion_count": 3,
      "ties_vs_fusion_count": 0
    },
    {
      "canonical_step_name": "BULL",
      "backend": "gemini",
      "n_pairs": 5,
      "delta_vs_fusion_mean": -6.13,
      "wins_vs_fusion_count": 3,
      "losses_vs_fusion_count": 2,
      "ties_vs_fusion_count": 0
    },
    {
      "canonical_step_name": "RED_TEAM",
      "backend": "claude",
      "n_pairs": 4,
      "delta_vs_fusion_mean": -8.73,
      "wins_vs_fusion_count": 1,
      "losses_vs_fusion_count": 3,
      "ties_vs_fusion_count": 0
    },
    {
      "canonical_step_name": "RED_TEAM",
      "backend": "codex",
      "n_pairs": 4,
      "delta_vs_fusion_mean": -0.24,
      "wins_vs_fusion_count": 2,
      "losses_vs_fusion_count": 2,
      "ties_vs_fusion_count": 0
    },
    {
      "canonical_step_name": "RED_TEAM",
      "backend": "gemini",
      "n_pairs": 4,
      "delta_vs_fusion_mean": -7.97,
      "wins_vs_fusion_count": 2,
      "losses_vs_fusion_count": 1,
      "ties_vs_fusion_count": 1
    }
  ],
  "_meta": {
    "config_hash": "b196e415cb8b7ef6f9091b05a4101873f0fd8390d51ce767a7c4f02a1474f4fe"
  }
}